{
  "$schema": "https://just-agent.github.io/Just-Product-Preview/schema/just-preview.config.schema.json",
  "defaults": {
    "outputDir": "outputs",
    "viewport": "desktop",
    "waitUntil": "networkidle",
    "timeout": 30000,
    "waitForTimeout": 500,
    "serveTimeout": 30000,
    "serveSilent": true
  },
  "thumbnail": {
    "output": "outputs/cover.png",
    "fullPage": false,
    "quality": 90
  },
  "video": {
    "output": "outputs/preview.mp4",
    "duration": 8,
    "autoScroll": false,
    "recordingsDir": "recordings",
    "fps": 30,
    "crf": 23,
    "serveCommand": "pnpm dev",
    "serveUrl": "http://localhost:3000",
    "serveCwd": "."
  },
  "gif": {
    "output": "outputs/preview.gif",
    "duration": 6,
    "gifFps": 12,
    "gifWidth": 960
  },
  "recipe": {
    "output": "outputs/recipe-preview.mp4",
    "recordingsDir": "recordings",
    "duration": 1
  },
  "publish": {
    "manifest": "outputs/cover.manifest.json,outputs/preview.manifest.json,outputs/gif.manifest.json",
    "format": "pr-comment",
    "output": "outputs/pr-comment.md",
    "title": "Just-Preview artifacts",
    "description": "Preview assets generated by Just-Preview for this project."
  }
}
